{
  "$schema": "../../../schemas/perturbation.schema.json",
  "id": "perturbation.exhibition.artwork-unavailable",
  "family": "dependency",
  "visibility": "revealed",
  "protectedInvariants": ["visitor agency", "no invented interpretation", "promotion authority"],
  "changedConditions": ["one referenced artwork is temporarily unavailable"],
  "revealGate": "candidate-frozen",
  "evaluationDimensions": ["continued utility", "stale-reference risk", "repair scope"],
  "severity": "moderate",
  "recoveryRequired": true,
  "steward": "perturbation-steward.synthetic"
}
